{
  "meta": {
    "schema": "daily",
    "schema_version": "0.1",
    "revision": 1,
    "created_at": "2026-09-21T09:00:00+09:00",
    "updated_at": "2026-09-21T09:00:00+09:00",
    "updated_by": "tester"
  },
  "daily_id": "D-260922-tester-05",
  "date": "2026-09-22",
  "tag": "26-09-22",
  "author": "tester",
  "project_id": "P-DAT-105",
  "category": "DATA",
  "visibility": "project",
  "raw_text": "분석 9/22 완료. 수율 95.0%에서 96.0%로 개선 확인. 결과 공유 9/30 예정.",
  "tables": [],
  "pics": [],
  "links": [],
  "deleted": false
}
