{
  "meta": {
    "schema": "daily",
    "schema_version": "0.1",
    "revision": 2,
    "created_at": "2026-09-28T10:20:00+09:00",
    "updated_at": "2026-09-28T10:40:00+09:00",
    "updated_by": "ljh"
  },
  "daily_id": "D-260928-ljh-01",
  "date": "2026-09-28",
  "tag": "26-09-28",
  "author": "ljh",
  "project_id": "P-ASM-001",
  "category": "DATA",
  "visibility": "project",
  "raw_text": "추석 지나고 2주치 데이터로 재료교체 효과 다시 봤음. ESWA MEB E77 전호기는 적용 전 0.171%에서 2주 평균 0.139%로 줄었고, 4일 볼 때(0.144%)보다 조금 더 좋아짐. ESMI1 #2-2,3은 0.367% -> 0.221%. 단기 효과가 유지되는 걸로 보이는데 한두 주 더 봐야 할 듯.",
  "tables": [
    {
      "table_id": "T1",
      "title": "재료교체 위치 불량률 (적용 전 / 4일 / 2주)",
      "columns": [
        "구분",
        "적용 전(%)",
        "4일(%)",
        "2주(%)"
      ],
      "rows": [
        [
          "ESWA MEB E77",
          0.171,
          0.144,
          0.139
        ],
        [
          "ESMI1 #2-2,3",
          0.367,
          0.23,
          0.221
        ]
      ]
    }
  ],
  "pics": [],
  "links": [],
  "deleted": false
}
