{
  "meta": {
    "schema": "daily",
    "schema_version": "0.1",
    "revision": 1,
    "created_at": "2026-09-21T09:00:00+09:00",
    "updated_at": "2026-09-21T09:00:00+09:00",
    "updated_by": "tester"
  },
  "daily_id": "D-260922-tester-01",
  "date": "2026-09-22",
  "tag": "26-09-22",
  "author": "tester",
  "project_id": "P-APC-101",
  "category": "DEV",
  "visibility": "project",
  "raw_text": "로직 검증 9/22 완료, 불량률 0.180%에서 0.150%로 감소. 양산 적용 9/30 예정.",
  "tables": [],
  "pics": [],
  "links": [],
  "deleted": false
}
