{
  "meta": {
    "schema": "daily",
    "schema_version": "0.1",
    "revision": 1,
    "created_at": "2026-09-29T09:10:00+09:00",
    "updated_at": "2026-09-29T09:10:00+09:00",
    "updated_by": "ljh"
  },
  "daily_id": "D-260929-ljh-01",
  "date": "2026-09-29",
  "tag": "26-09-29",
  "author": "ljh",
  "project_id": null,
  "category": null,
  "visibility": "private",
  "raw_text": "점심 회의실 예약하기, 교육 신청서 제출",
  "tables": [],
  "pics": [],
  "links": [],
  "deleted": false
}
