{
  "meta": {
    "schema": "daily",
    "schema_version": "0.1",
    "revision": 1,
    "created_at": "2026-09-30T17:50:00+09:00",
    "updated_at": "2026-09-30T17:50:00+09:00",
    "updated_by": "khw"
  },
  "daily_id": "D-260930-khw-01",
  "date": "2026-09-30",
  "tag": "26-09-30",
  "author": "khw",
  "project_id": "P-ASM-001",
  "category": "ROLL",
  "visibility": "project",
  "raw_text": "MI_HL Normal line 2대 적용 완료해서 Normal line 수평전개 전체 끝났음(9/30). 지금까지 적용 호기 누적 26대.",
  "tables": [],
  "pics": [],
  "links": [],
  "deleted": false
}
