{
  "meta": {
    "schema": "daily",
    "schema_version": "0.1",
    "revision": 1,
    "created_at": "2026-10-01T11:00:00+09:00",
    "updated_at": "2026-10-01T11:00:00+09:00",
    "updated_by": "ljh"
  },
  "daily_id": "D-261001-ljh-02",
  "date": "2026-10-01",
  "tag": "26-10-01",
  "author": "ljh",
  "project_id": "P-ASM-001",
  "category": "ROLL",
  "visibility": "project",
  "raw_text": "북미 10/20 적용 예정이라고 들음",
  "tables": [],
  "pics": [],
  "links": [],
  "deleted": true
}
