{
  "meta": {
    "schema": "daily",
    "schema_version": "0.1",
    "revision": 1,
    "created_at": "2026-09-21T17:50:00+09:00",
    "updated_at": "2026-09-21T17:50:00+09:00",
    "updated_by": "ljh"
  },
  "daily_id": "D-260921-ljh-01",
  "date": "2026-09-21",
  "tag": "26-09-21",
  "author": "ljh",
  "project_id": null,
  "category": null,
  "visibility": "private",
  "raw_text": "(개인 메모 예시) 다음 주 교육 신청 마감 확인",
  "tables": [],
  "pics": [],
  "links": [],
  "deleted": false
}