{
  "meta": {
    "schema": "daily",
    "schema_version": "0.1",
    "revision": 1,
    "created_at": "2026-09-21T09:00:00+09:00",
    "updated_at": "2026-09-21T09:00:00+09:00",
    "updated_by": "tester"
  },
  "daily_id": "D-260922-tester-02",
  "date": "2026-09-22",
  "tag": "26-09-22",
  "author": "tester",
  "project_id": "P-ROL-102",
  "category": "ROLL",
  "visibility": "project",
  "raw_text": "사이트 검증 9/22 완료. WA 적용 9/25에서 9/30으로 변경.",
  "tables": [],
  "pics": [],
  "links": [],
  "deleted": false
}
